{
  "refactoring": "replace-type-code-with-enum",
  "description": "Refuses when the code is used as a number, which an enum does not allow",
  "target": { "symbol": "T:Staff.Employee" },
  "arguments": { "name": "EmployeeType", "constants": ["Engineer", "Salesman"] },
  "expect": "error",
  "errorCode": "breaks-compilation"
}
