{
  "refactoring": "replace-type-code-with-enum",
  "description": "Carries the constants' comments to the enum members and keeps the comments beside the retyped declarations",
  "target": { "symbol": "T:Staff.Employee" },
  "arguments": { "name": "EmployeeType", "constants": ["Engineer", "Salesman"] }
}
